authors,paperId,title,venue,year,no_citations,abstract
"I. Oguz, Mahshid Farzinfar, J. Matsui, François Budin, Zhexing Liu, G. Gerig, H. Johnson, M. Styner",23136244a1292d17cb0f2d01b265c4f7bf4fa8b9,DTIPrep: quality control of diffusion-weighted images,Front. Neuroinform.,2014,218,"In the last decade, diffusion MRI (dMRI) studies of the human and animal brain have been used to investigate a multitude of pathologies and drug-related effects in neuroscience research. Study after study identifies white matter (WM) degeneration as a crucial biomarker for all these diseases. The tool of choice for studying WM is dMRI. However, dMRI has inherently low signal-to-noise ratio and its acquisition requires a relatively long scan time; in fact, the high loads required occasionally stress scanner hardware past the point of physical failure. As a result, many types of artifacts implicate the quality of diffusion imagery. Using these complex scans containing artifacts without quality control (QC) can result in considerable error and bias in the subsequent analysis, negatively affecting the results of research studies using them. However, dMRI QC remains an under-recognized issue in the dMRI community as there are no user-friendly tools commonly available to comprehensively address the issue of dMRI QC. As a result, current dMRI studies often perform a poor job at dMRI QC. Thorough QC of dMRI will reduce measurement noise and improve reproducibility, and sensitivity in neuroimaging studies; this will allow researchers to more fully exploit the power of the dMRI technique and will ultimately advance neuroscience. Therefore, in this manuscript, we present our open-source software, DTIPrep, as a unified, user friendly platform for thorough QC of dMRI data. These include artifacts caused by eddy-currents, head motion, bed vibration and pulsation, venetian blind artifacts, as well as slice-wise and gradient-wise intensity inconsistencies. This paper summarizes a basic set of features of DTIPrep described earlier and focuses on newly added capabilities related to directional artifacts and bias analysis."
"D. Alexander, D. Zikic, Jiaying Zhang, Hui Zhang, A. Criminisi",ba477d264f3518d3c9ef8b07cf3da279b99192a0,Image Quality Transfer via Random Forest Regression: Applications in Diffusion MRI,International Conference on Medical Image Computing and Computer-Assisted Intervention,2014,100,
"J. Masson, P. Dionne, Charlotte Salvatico, M. Renner, C. Specht, A. Triller, M. Dahan",36329219f6baa0b1a4f696223fa1682544776759,Mapping the energy and diffusion landscapes of membrane proteins at the cell surface using high-density single-molecule imaging and Bayesian inference: application to the multiscale dynamics of glycine receptors in the neuronal membrane.,Biophysical Journal,2014,88,
"M. Ruschel, T. Knösche, A. Friederici, R. Turner, S. Geyer, A. Anwander",24fd998a2563bec1d11cd3d0af92e4d43d71855b,Connectivity architecture and subdivision of the human inferior parietal cortex revealed by diffusion MRI.,Cerebral Cortex,2014,84,"The human inferior parietal cortex convexity (IPCC) is an important association area, which integrates auditory, visual, and somatosensory information. However, the structural organization of the IPCC is a controversial issue. For example, cytoarchitectonic parcellations reported in the literature range from 2 to 7 areas. Moreover, anatomical descriptions of the human IPCC are often based on experiments in the macaque monkey. In this study, we used diffusion-weighted magnetic resonance imaging combined with probabilistic tractography to quantify the connectivity of the human IPCC, and used this information to parcellate this cortex area. This provides a new structural map of the human IPCC, comprising 3 subareas (inferior parietal cortex anterior, IPC middle, and IPC posterior) of comparable size, in a rostro-caudal arrangement in the left and right hemispheres. Each subarea is characterized by a connectivity fingerprint, and the parcellation is similar to the subdivision reported for the macaque IPCC with 3 areas in a rostro-caudal arrangement (PF, PFG, and PG). However, the present study also reliably demonstrates new structural features in the connectivity pattern of the human IPCC, which are not known to exist in the macaque. This study quantifies intersubject variability by providing a population representation of the subarea arrangement and demonstrates the substantial lateralization of the connectivity patterns of the IPCC."
"F. Lam, S. D. Babacan, J. Haldar, M. Weiner, N. Schuff, Zhi-Pei Liang",b96b92ef485fb4ec0a0cf86f2923509a1c56e5d7,Denoising diffusion‐weighted magnitude MR images using rank and edge constraints,Magnetic Resonance in Medicine,2014,70,To improve signal‐to‐noise ratio for diffusion‐weighted magnetic resonance images.
"A. Rosenkrantz, H. Chandarana, J. Pfeuffer, Michael J. Triolo, M. Shaikh, D. Mossa, C. Geppert",d3c299343fde37315f2dd8440c07861e22ee8dc2,Zoomed echo-planar imaging using parallel transmission: impact on image quality of diffusion-weighted imaging of the prostate at 3T,Abdominal Imaging,2014,67,
"M. Chung, A. Qiu, Seongho Seo, H. K. Vorperian",0089c5cf5a0c1c464975f49b695b3c5e1e1a2edb,"Unified Heat Kernel Regression for Diffusion, Kernel Smoothing and Wavelets on Manifolds and Its Application to Mandible Growth Modeling in CT Images",Medical Image Anal.,2014,55,
"Luam C. Totti, Felipe Almeida Costa, S. Avila, Eduardo Valle, Wagner Meira Jr, Virgílio A. F. Almeida",6ceacd889559cfcf0009e914d47f915167231846,The impact of visual attributes on online image diffusion,Web Science Conference,2014,48,"Little is known on how visual content affects the popularity on social networks, despite images being now ubiquitous on the Web, and currently accounting for a considerable fraction of all content shared. Existing art on image sharing focuses mainly on non-visual attributes. In this work we take a complementary approach, and investigate resharing from a mainly visual perspective. Two sets of visual features are proposed, encoding both aesthetical properties (brightness, contrast, sharpness, etc.), and semantical content (concepts represented by the images). We collected data from a large image-sharing service (Pinterest) and evaluated the predictive power of different features on popularity (number of reshares). We found that visual properties have low predictive power compared that of social cues. However, after factoring-out social influence, visual features show considerable predictive power, especially for images with higher exposure, with over 3:1 accuracy odds when classifying highly exposed images between very popular and unpopular."
"Junxin Chen, Zhiliang Zhu, Hai Yu",aa4f840c4917a610ca5aff7f50f32a61c7707945,A fast chaos-based symmetric image cryptosystem with an improved diffusion scheme,,2014,39,
"R. Inano, N. Oishi, T. Kunieda, Y. Arakawa, Y. Yamao, S. Shibata, T. Kikuchi, H. Fukuyama, S. Miyamoto",f9d79b7d72007a7e66351446c9e9b096a9b8bbea,Voxel-based clustered imaging by multiparameter diffusion tensor images for glioma grading,NeuroImage: Clinical,2014,38,
"Muwei Li, Yuanyuan Qin, F. Gao, Wenzhen Zhu, Xiaohai He",8bbd12eedbeefb507a33f1c4d6370850ee7994a9,Discriminative analysis of multivariate features from structural MRI and diffusion tensor images.,Magnetic Resonance Imaging,2014,37,
"Jiong Zhang, R. Duits, B. H. Romeny",3ee68e754708e8034cbfbc510d2ddcb1538b8e77,"Numerical Approaches for Linear Left-invariant Diffusions on SE(2), their Comparison to Exact Solutions, and their Applications in Retinal Imaging","Numerical Mathematics: Theory, Methods and Applications",2014,32,"Left-invariant PDE-evolutions on the roto-translation groupSE(2)(and their resolvent equations) have been widely studied in the fields of cortical modeling and image analysis. They include hypo-elliptic diffusion (for contour enhancement) proposed by Citti & Sarti, and Petitot, and they include the direction process (for contour completion) proposed by Mumford. This paper presents a thorough study and comparison of the many numerical approaches, which, remarkably, are missing in the literature. Existing numerical approaches can be classified into 3 categories: Finite difference methods, Fourier based methods (equivalent toSE(2)-Fourier methods), and stochastic methods (Monte Carlo simulations). There are also 3 types of exact solutions to the PDE-evolutions that were derived explicitly (in the spatial Fourier domain) in previous works by Duits and van Almsick in 2005. Here we provide an overview of these 3 types of exact solutions and explain how they relate to each of the 3 numerical approaches. We compute relative errors of all numerical approaches to the exact solutions, and the Fourier based methods show us the best performance with smallest relative errors. We also provide an improvement of Mathematica algorithms for evaluating Mathieu-functions, crucial in implementations of the exact solutions. Furthermore, we include an asymptotical analysis of the singularities within the kernels and we propose a probabilistic extension of underlying stochastic processes that overcomes the singular behavior in the origin of time-integrated kernels. Finally, we show retinal imaging applications of combining left-invariant PDE-evolutions with invertible orientation scores."
"V. B. Surya Prasath, D. Vorotnikov",6dc7a027f52ecc55c3d7fc4b9a73e47916ec224c,Weighted and well-balanced anisotropic diffusion scheme for image denoising and restoration,,2014,29,
"C. E. Han, L. Peraza, John-Paul Taylor, Marcus Kaiser",50a1baba2305cdc30bd9e9bc34125f6904c31bf4,Predicting age across human lifespan based on structural connectivity from diffusion tensor imaging,2014 IEEE Biomedical Circuits and Systems Conference (BioCAS) Proceedings,2014,22,"Predicting brain maturity using noninvasive magnetic resonance images (MRI) can distinguish different age groups and help to assess neurodevelopmental disorders. However, group-wise differences are often less informative for assessing features of individuals. Here, we propose a simple method to predict the age of an individual subject solely based on structural connectivity data from diffusion tensor imaging (DTI). Our simple predictor computes a weighted sum of connection strengths of an individual, where weights are the importance of that connection for an observed feature-age in this case. The weights are simply determined through correlations between connection strength and age; thus the proposed predictor requires no parameter tuning. We tested this approach using DTI data from 201 healthy subjects aged 4 to 85 years. After determining importance in a training dataset, our predicted ages in the test dataset showed a strong correlation (r = 0.79) with real age deviating by, on average, only about 9 years."
"J. Cho, E. Kim, Jinna Kim, Seung Koo Lee, S. H. Kim, Kyu-Sung Lee, Jong-Hee Chang",b49c501a35222d4b3e8334670741848b06b7c25d,"Clinical Use of Diffusion Tensor Image-Merged Functional Neuronavigation for Brain Tumor Surgeries: Review of Preoperative, Intraoperative, and Postoperative Data for 123 Cases",Yonsei medical journal,2014,20,"Purpose To achieve maximal safe resection during brain tumor surgery, functional image-merged neuronavigation is widely used. We retrospectively reviewed our cases in which diffusion tensor image (DTI)-merged functional neuronavigation was performed during surgery. Materials and Methods Between November 2008 and May 2010, 123 patients underwent surgery utilizing DTI-merged neuronavigation. Anatomical magnetic resonance images (MRI) were obtained preoperatively and fused with DTI of major white matter tracts, such as the corticospinal tract, optic radiation, or arcuate fasciculus. We used this fused image for functional neuronavigation during brain tumor surgery of eloquent areas. We checked the DTI images together with postoperative MRI images and evaluated the integrity of white matter tracts. Results A single white matter tract was inspected in 78 patients, and two or more white matter tracts were checked in 45 patients. Among the 123 patients, a grossly total resection was achieved in 90 patients (73.2%), subtotal resection in 29 patients (23.6%), and partial resection in 4 patients (3.3%). Postoperative neurologic outcomes, compared with preoperative function, included the following: 100 patients (81.3%) displayed improvement of neurologic symptoms or no change, 7 patients (5.7%) experienced postoperative permanent neurologic deterioration (additional or aggravated neurologic symptoms), and 16 patients (13.0%) demonstrated transient worsening. Conclusion DTI-merged functional neuronavigation could be a useful tool in brain tumor surgery for maximal safe resection. However, there are still limitations, including white matter tract shift, during surgery and in DTI itself. Further studies should be conducted to overcome these limitations."
"L. Zhang, Kwok-wo Wong, Yushu Zhang, Qiuzhen Lin",845bfa94266931495ec2f69e919e8dc92c3dfcfe,Joint quantization and diffusion for compressed sensing measurements of natural images,International Symposium on Circuits and Systems,2014,18,"Recent research advances have revealed the computational secrecy of the compressed sensing (CS) paradigm. Perfect secrecy can also be achieved by normalizing the CS measurement vector. However, these findings are established on real-valued measurements while digital devices can only store the samples at a finite precision. Based on the distribution of measurements of natural images sensed by structurally random ensemble, a joint quantization and diffusion approach for the real-valued measurements is suggested. In this way, a nonlinear cryptographic diffusion is intrinsically imposed on the CS quantization process and the overall security level is thus enhanced. It is shown that the proposed scheme is able to resist known-plaintext attack while the original CS scheme without quantization cannot."
"P. Yap, H. An, Yasheng Chen, D. Shen",3c9c09a94d3868d4a90fc3ab38e01c956d17ae9d,Fiber-driven resolution enhancement of diffusion-weighted images,NeuroImage,2014,16,
"U. Boscain, J. Gauthier, D. Prandi, A. Remizov",2b9e2cdef267f8e206edb435414d34084b9bcb82,Image reconstruction via non-isotropic diffusion in Dubins/Reed-Shepp-like control systems,IEEE Conference on Decision and Control,2014,14,"We compare the image inpainting results of two models of geometry of vision obtained through control theoretic considerations (the semi-discrete versions of the Citti-Petitot-Sarti and Mumford Elastica models). The main feature described by these models is the lifting of 2D images to the 3D group of translations and discrete rotations on the plane SE(2,N), done by the primary visual cortex. Corrupted images are then reconstructed by minimizing the energy necessary to activate neurons corresponding to the missing regions. This minimization procedure, which gives rise to Dubins/Reed-Shepp-like optimal control problems in the case of corrupted curves, is described by an hypoelliptic diffusion on SE(2,N). We present two numerical algorithms for the resolution of the diffusion equation in both models and then compare the results."
"M. Ahmad, H. Al-Sharari, M. Nizam",0c042eaf88ec7769ee2426b49a157859318fad1d,Security Improvement of an Image Encryption Based on mPixel-Chaotic-Shuffle and Pixel-Chaotic-Diffusion,ArXiv,2014,12,"In this paper, we propose to improve the security performance of a recently proposed color image encryption algorithm which is based on multi-chaotic systems. The existing cryptosystem employed a pixel-chaotic-shuffle mechanism to encrypt images, in which the generation of shuffling sequences are independent to the plain-image/cipher-image. As a result, it fails to the chosen-plaintext and known-plaintext attacks. Moreover, the statistical features of the cryptosystem are not up to the standard. Therefore, the security improvements are framed to make the above attacks infeasible and enhance the statistical features as well. It is achieved by modifying the pixel-chaotic-shuffle mechanism and adding a new pixel-chaotic-diffusion mechanism to it. The keys for diffusion of pixels are extracted from the same chaotic sequences generated in the previous stage. The simulation analyses and studies are performed to demonstrate that the updated version of cryptosystem has better statistical features and resistant to the chosen-plaintext and known-plaintext attacks than the existing algorithm."
"S. Powell, S. Arridge, T. Leung",0a5250795861be146e085c5a023a1974ba40f1dc,Gradient-Based Quantitative Image Reconstruction in Ultrasound-Modulated Optical Tomography: First Harmonic Measurement Type in a Linearised Diffusion Formulation,IEEE Transactions on Medical Imaging,2014,10,"Ultrasound-modulated optical tomography is an emerging biomedical imaging modality which uses the spatially localised acoustically-driven modulation of coherent light as a probe of the structure and optical properties of biological tissues. In this work we begin by providing an overview of forward modelling methods, before deriving a linearised diffusion-style model which calculates the first-harmonic modulated flux measured on the boundary of a given domain. We derive and examine the correlation measurement density functions of the model which describe the sensitivity of the modality to perturbations in the optical parameters of interest. Finally, we employ said functions in the development of an adjoint-assisted gradient based image reconstruction method, which ameliorates the computational burden and memory requirements of a traditional Newton-based optimisation approach. We validate our work by performing reconstructions of optical absorption and scattering in two- and three-dimensions using simulated measurements with 1% proportional Gaussian noise, and demonstrate the successful recovery of the parameters to within ±5% of their true values when the resolution of the ultrasound raster probing the domain is sufficient to delineate perturbing inclusions."
"Jingyue Wang, Weizhang Huang",66d1b59d39b752dfa7584c2c755908166a128671,Image Segmentation With Eigenfunctions of an Anisotropic Diffusion Operator,IEEE Transactions on Image Processing,2014,7,"We propose the eigenvalue problem of an anisotropic diffusion operator for image segmentation. The diffusion matrix is defined based on the input image. The eigenfunctions and the projection of the input image in some eigenspace capture key features of the input image. An important property of the model is that for many input images, the first few eigenfunctions are close to being piecewise constant, which makes them useful as the basis for a variety of applications, such as image segmentation and edge detection. The eigenvalue problem is shown to be related to the algebraic eigenvalue problems resulting from several commonly used discrete spectral clustering models. The relation provides a better understanding and helps developing more efficient numerical implementation and rigorous numerical analysis for discrete spectral segmentation methods. The new continuous model is also different from energy-minimization methods such as active contour models in that no initial guess is required for in the current model. A numerical implementation based on a finite-element method with an anisotropic mesh adaptation strategy is presented. It is shown that the numerical scheme gives much more accurate results on eigenfunctions than uniform meshes. Several interesting features of the model are examined in numerical examples, and possible applications are discussed."
"Yu-Qian Yang, Cheng-Yi Zhang",2e2968194a97564a642a4e7323f8abdabf5cc0d2,Kernel Based Telegraph-Diffusion Equation for Image Noise Removal,,2014,6,"The second-order partial differential equations have good performances on noise smoothing and edge preservation. However, for low signal-to-noise ratio (SNR) images, the discrimination between edges and noise is a challenging problem. In this paper, the authors propose a kernel based telegraph-diffusion equation (KTDE) for noise removal. In this method, a kernelized gradient operator is introduced in the second-order telegraph-diffusion equation (TDE), which leads to more effective noise removal capability. Experiment results show that this method outperforms several anisotropic diffusion methods and the TDE method for noise removal and edge preservation."
"V. B. Surya Prasath, R. Delhibabu",5fe666f0fd652d21f2eeed8d0995c9d58ded94b9,Automatic Contrast Parameter Estimation in Anisotropic Diffusion for Image Restoration,"International Joint Conference on the Analysis of Images, Social Networks and Texts",2014,5,
V. Barbu,373f1b731e2348b3339cb192e601b6278fbc22e7,Nonlinear Diffusion equations in image processing,,2014,4,"One surveys here a few nonlinear di usion models in image restoration and denoising with main emphasis on that described by nonlinear parabolic equations of gradient type. The well-posedness of the corresponding Cauchy problem as well as stability of the derived nite di erence scheme is studied from perspectives of nonlinear semigroup theory. As a matter of fact, most of denoising PDE procedures existing in literature though apparently are e cient at experimental level, are however mathematically ill posed and our e ort here is to put them on more rigorous mathematical basis."
"Dario Gasbarra, Jia Liu, Juha Railavo",32fd01f1200518129f592b69ddd18946e3c9d805,Data augmentation in Rician noise model and Bayesian Diffusion Tensor Imaging,,2014,4,"Mapping white matter tracts is an essential step towards understanding brain function. Diffusion Magnetic Resonance Imaging (dMRI) is the only noninvasive technique which can detect in vivo anisotropies in the 3-dimensional diffusion of water molecules, which correspond to nervous fibers in the living brain. In this process, spectral data from the displacement distribution of water molecules is collected by a magnetic resonance scanner. From the statistical point of view, inverting the Fourier transform from such sparse and noisy spectral measurements leads to a non-linear regression problem. Diffusion tensor imaging (DTI) is the simplest modeling approach postulating a Gaussian displacement distribution at each volume element (voxel). Typically the inference is based on a linearized log-normal regression model that can fit the spectral data at low frequencies. However such approximation fails to fit the high frequency measurements which contain information about the details of the displacement distribution but have a low signal to noise ratio. In this paper, we directly work with the Rice noise model and cover the full range of $b$-values. Using data augmentation to represent the likelihood, we reduce the non-linear regression problem to the framework of generalized linear models. Then we construct a Bayesian hierarchical model in order to perform simultaneously estimation and regularization of the tensor field. Finally the Bayesian paradigm is implemented by using Markov chain Monte Carlo."
Neda Pourali,46487b2a22dd8ce57606518fc7a8574f4071fad4,Web image annotation by diffusion maps manifold learning algorithm,IEEE Annual Symposium on Foundations of Computer Science,2014,0,"Automatic image annotation is one of the most challenging problems in machine vision areas. The goal of this task is to predict number of keywords automatically for images captured in real data. Many methods are based on visual features in order to calculate similarities between image samples. But the computation cost of these approaches is very high. These methods require many training samples to be stored in memory. To lessen this burden, a number of techniques have been developed to reduce the number of features in a dataset. Manifold learning is a popular approach to nonlinear dimensionality reduction. In this paper, we investigate Diffusion maps manifold learning method for web image auto-annotation task. Diffusion maps manifold learning method is used to reduce the dimension of some visual features. Extensive experiments and analysis on NUS-WIDE-LITE web image dataset with different visual features show how this manifold learning dimensionality reduction method can be applied effectively to image annotation."
"E. I. Khadikova, M. Montagnese, F. D. Haan, P. Loosdrecht",3aba11c1c0fa5276c0fd588e43f4ecd4d6840dbd,Modelling Dynamical Fluorescent Micro Thermal Imaging of the Heat Diffusion in the La5Ca9Cu24O41 Spin Ladder Compound,,2014,0,"The dynamical fluorescent microthermal imaging (FMI) experiment has been used to investigate the phonon-magnon interaction in the 1D Heisenberg antiferromagnet La5Ca9Cu24O41. This material shows highly anisotropic heat conductivity due to the efficient magnetic heat transport along the spin ladders in the compound. To extract information on the phonon-magnon interaction we modelled the dynamic heat transport experiment using a two temperature model approach, taking both the crystal as well as the PMMA/EuTTA fluorescent heat imaging layer into account. The simulations are carried out by the finite element method using COMSOL Multiphysics Heat Transfer Module. The results of the numerical calculations are expected to be used for the data analysis of the experimental studies."
