authors,paperId,title,venue,year,no_citations,abstract
"Lvmin Zhang, Maneesh Agrawala",e55695dfe6cde42ee195aa6672fe720ec92ee8c3,Adding Conditional Control to Text-to-Image Diffusion Models,ArXiv,2023,50,"We present a neural network structure, ControlNet, to control pretrained large diffusion models to support additional input conditions. The ControlNet learns task-specific conditions in an end-to-end way, and the learning is robust even when the training dataset is small (<50k). Moreover, training a ControlNet is as fast as fine-tuning a diffusion model, and the model can be trained on a personal devices. Alternatively, if powerful computation clusters are available, the model can scale to large amounts (millions to billions) of data. We report that large diffusion models like Stable Diffusion can be augmented with ControlNets to enable conditional inputs like edge maps, segmentation maps, keypoints, etc. This may enrich the methods to control large diffusion models and further facilitate related applications."
"Chong Mou, Xintao Wang, Liangbin Xie, Jing Zhang, Zhongang Qi, Ying Shan, Xiaohu Qie",58842cdca3ea68f7b9e638b288fc247a6f26dafc,T2I-Adapter: Learning Adapters to Dig out More Controllable Ability for Text-to-Image Diffusion Models,ArXiv,2023,14,"The incredible generative ability of large-scale text-to-image (T2I) models has demonstrated strong power of learning complex structures and meaningful semantics. However, relying solely on text prompts cannot fully take advantage of the knowledge learned by the model, especially when flexible and accurate controlling (e.g., color and structure) is needed. In this paper, we aim to ``dig out""the capabilities that T2I models have implicitly learned, and then explicitly use them to control the generation more granularly. Specifically, we propose to learn simple and lightweight T2I-Adapters to align internal knowledge in T2I models with external control signals, while freezing the original large T2I models. In this way, we can train various adapters according to different conditions, achieving rich control and editing effects in the color and structure of the generation results. Further, the proposed T2I-Adapters have attractive properties of practical value, such as composability and generalization ability. Extensive experiments demonstrate that our T2I-Adapter has promising generation quality and a wide range of applications."
"Hila Chefer, Yuval Alaluf, Yael Vinker, Lior Wolf, D. Cohen-Or",d84f6d72cd152734e676f598ffeba20c7762e15b,Attend-and-Excite: Attention-Based Semantic Guidance for Text-to-Image Diffusion Models,ArXiv,2023,7,"Recent text-to-image generative models have demonstrated an unparalleled ability to generate diverse and creative imagery guided by a target text prompt. While revolutionary, current state-of-the-art diffusion models may still fail in generating images that fully convey the semantics in the given text prompt. We analyze the publicly available Stable Diffusion model and assess the existence of catastrophic neglect, where the model fails to generate one or more of the subjects from the input prompt. Moreover, we find that in some cases the model also fails to correctly bind attributes (e.g., colors) to their corresponding subjects. To help mitigate these failure cases, we introduce the concept of Generative Semantic Nursing (GSN), where we seek to intervene in the generative process on the fly during inference time to improve the faithfulness of the generated images. Using an attention-based formulation of GSN, dubbed Attend-and-Excite, we guide the model to refine the cross-attention units to attend to all subject tokens in the text prompt and strengthen - or excite - their activations, encouraging the model to generate all subjects described in the text prompt. We compare our approach to alternative approaches and demonstrate that it conveys the desired concepts more faithfully across a range of text prompts."
"E. Hoogeboom, J. Heek, Tim Salimans",6e3a3b7a8a0376d867cad72eedf2f9b746f29a33,simple diffusion: End-to-end diffusion for high resolution images,ArXiv,2023,7,"Currently, applying diffusion models in pixel space of high resolution images is difficult. Instead, existing approaches focus on diffusion in lower dimensional spaces (latent diffusion), or have multiple super-resolution levels of generation referred to as cascades. The downside is that these approaches add additional complexity to the diffusion framework. This paper aims to improve denoising diffusion for high resolution images while keeping the model as simple as possible. The paper is centered around the research question: How can one train a standard denoising diffusion models on high resolution images, and still obtain performance comparable to these alternate approaches? The four main findings are: 1) the noise schedule should be adjusted for high resolution images, 2) It is sufficient to scale only a particular part of the architecture, 3) dropout should be added at specific locations in the architecture, and 4) downsampling is an effective strategy to avoid high resolution feature maps. Combining these simple yet effective techniques, we achieve state-of-the-art on image generation among diffusion models without sampling modifiers on ImageNet."
"Yu Takagi, Shinji Nishimoto",2824f18b3aeaae51b3fbe0d629c9b8a728da86d7,High-resolution image reconstruction with latent diffusion models from human brain activity,bioRxiv,2023,6,"Reconstructing visual experiences from human brain activity offers a unique way to understand how the brain represents the world, and to interpret the connection between computer vision models and our visual system. While deep generative models have recently been employed for this task, reconstructing realistic images with high semantic fidelity is still a challenging problem. Here, we propose a new method based on a diffusion model (DM) to reconstruct images from human brain activity obtained via functional magnetic resonance imaging (fMRI). More specifically, we rely on a latent diffusion model (LDM) termed Stable Diffusion. This model reduces the computational cost of DMs, while preserving their high generative performance. We also characterize the inner mechanisms of the LDM by studying how its different components (such as the latent vector of image Z, conditioning inputs C, and different elements of the denoising U-Net) relate to distinct brain functions. We show that our proposed method can reconstruct high-resolution images with high fidelity in straight-forward fashion, without the need for any additional training and fine-tuning of complex deep-learning models. We also provide a quantitative interpretation of different LDM components from a neuroscientific perspective. Overall, our study proposes a promising method for reconstructing images from human brain activity, and provides a new framework for understanding DMs. Please check out our webpage at https://sites.google.com/view/stablediffusion-with-brain/."
"Litu Rout, Advait Parulekar, C. Caramanis, S. Shakkottai",19cd7d16764ee6a35a49f999f1885279f149ccee,A Theoretical Justification for Image Inpainting using Denoising Diffusion Probabilistic Models,ArXiv,2023,6,"We provide a theoretical justification for sample recovery using diffusion based image inpainting in a linear model setting. While most inpainting algorithms require retraining with each new mask, we prove that diffusion based inpainting generalizes well to unseen masks without retraining. We analyze a recently proposed popular diffusion based inpainting algorithm called RePaint (Lugmayr et al., 2022), and show that it has a bias due to misalignment that hampers sample recovery even in a two-state diffusion process. Motivated by our analysis, we propose a modified RePaint algorithm we call RePaint$^+$ that provably recovers the underlying true sample and enjoys a linear rate of convergence. It achieves this by rectifying the misalignment error present in drift and dispersion of the reverse process. To the best of our knowledge, this is the first linear convergence result for a diffusion based image inpainting algorithm."
"Omer Bar-Tal, Lior Yariv, Y. Lipman, Tali Dekel",9ced6e814457eae83f5415364e266143defc81d1,MultiDiffusion: Fusing Diffusion Paths for Controlled Image Generation,ArXiv,2023,4,"Recent advances in text-to-image generation with diffusion models present transformative capabilities in image quality. However, user controllability of the generated image, and fast adaptation to new tasks still remains an open challenge, currently mostly addressed by costly and long re-training and fine-tuning or ad-hoc adaptations to specific image generation tasks. In this work, we present MultiDiffusion, a unified framework that enables versatile and controllable image generation, using a pre-trained text-to-image diffusion model, without any further training or finetuning. At the center of our approach is a new generation process, based on an optimization task that binds together multiple diffusion generation processes with a shared set of parameters or constraints. We show that MultiDiffusion can be readily applied to generate high quality and diverse images that adhere to user-provided controls, such as desired aspect ratio (e.g., panorama), and spatial guiding signals, ranging from tight segmentation masks to bounding boxes. Project webpage: https://multidiffusion.github.io"
"Chenshuang Zhang, Chaoning Zhang, Mengchun Zhang, In-So Kweon",35ccd924de9e8483bdcf144cbf2edf09be157b7e,Text-to-image Diffusion Model in Generative AI: A Survey,ArXiv,2023,4,"This survey reviews text-to-image diffusion models in the context that diffusion models have emerged to be popular for a wide range of generative tasks. As a self-contained work, this survey starts with a brief introduction of how a basic diffusion model works for image synthesis, followed by how condition or guidance improves learning. Based on that, we present a review of state-of-the-art methods on text-conditioned image synthesis, i.e., text-to-image. We further summarize applications beyond text-to-image generation: text-guided creative generation and text-guided image editing. Beyond the progress made so far, we discuss existing challenges and promising future directions."
"Jiatao Gu, Alex Trevithick, Kai-En Lin, J. Susskind, C. Theobalt, Lingjie Liu, R. Ramamoorthi",a8efa7087fd6d84d5d84fd6c7c7cfb9d7ddb6dce,NerfDiff: Single-image View Synthesis with NeRF-guided Distillation from 3D-aware Diffusion,ArXiv,2023,3,"Novel view synthesis from a single image requires inferring occluded regions of objects and scenes whilst simultaneously maintaining semantic and physical consistency with the input. Existing approaches condition neural radiance fields (NeRF) on local image features, projecting points to the input image plane, and aggregating 2D features to perform volume rendering. However, under severe occlusion, this projection fails to resolve uncertainty, resulting in blurry renderings that lack details. In this work, we propose NerfDiff, which addresses this issue by distilling the knowledge of a 3D-aware conditional diffusion model (CDM) into NeRF through synthesizing and refining a set of virtual views at test time. We further propose a novel NeRF-guided distillation algorithm that simultaneously generates 3D consistent virtual views from the CDM samples, and finetunes the NeRF based on the improved virtual views. Our approach significantly outperforms existing NeRF-based and geometry-free approaches on challenging datasets, including ShapeNet, ABO, and Clevr3D."
"Mohamed Akrout, B'alint Gyepesi, P. Holló, A. Poór, Blága Kincso, Stephen Solis, Katrina D Cirone, J. Kawahara, Dekker Slade, Latif Abid, M'at'e Kov'acs, I. Fazekas",a69a61b81b31e16339df59cd125027522b11a775,Diffusion-based Data Augmentation for Skin Disease Classification: Impact Across Original Medical Datasets to Fully Synthetic Images,ArXiv,2023,3,"Despite continued advancement in recent years, deep neural networks still rely on large amounts of training data to avoid overfitting. However, labeled training data for real-world applications such as healthcare is limited and difficult to access given longstanding privacy, and strict data sharing policies. By manipulating image datasets in the pixel or feature space, existing data augmentation techniques represent one of the effective ways to improve the quantity and diversity of training data. Here, we look to advance augmentation techniques by building upon the emerging success of text-to-image diffusion probabilistic models in augmenting the training samples of our macroscopic skin disease dataset. We do so by enabling fine-grained control of the image generation process via input text prompts. We demonstrate that this generative data augmentation approach successfully maintains a similar classification accuracy of the visual classifier even when trained on a fully synthetic skin disease dataset. Similar to recent applications of generative models, our study suggests that diffusion models are indeed effective in generating high-quality skin images that do not sacrifice the classifier performance, and can improve the augmentation of training datasets after curation."
"M. Delbracio, P. Milanfar",1b0a5c650c4fbe9b038bf960fd1b2ee7854f99d7,Inversion by Direct Iteration: An Alternative to Denoising Diffusion for Image Restoration,ArXiv,2023,2,"Inversion by Direct Iteration (InDI) is a new formulation for supervised image restoration that avoids the so-called ``regression to the mean'' effect and produces more realistic and detailed images than existing regression-based methods. It does this by gradually improving image quality in small steps, similar to generative denoising diffusion models. Image restoration is an ill-posed problem where multiple high-quality images are plausible reconstructions of a given low-quality input. Therefore, the outcome of a single step regression model is typically an aggregate of all possible explanations, therefore lacking details and realism. The main advantage of InDI is that it does not try to predict the clean target image in a single step but instead gradually improves the image in small steps, resulting in better perceptual quality. While generative denoising diffusion models also work in small steps, our formulation is distinct in that it does not require knowledge of any analytic form of the degradation process. Instead, we directly learn an iterative restoration process from low-quality and high-quality paired examples. InDI can be applied to virtually any image degradation, given paired training data. In conditional denoising diffusion image restoration the denoising network generates the restored image by repeatedly denoising an initial image of pure noise, conditioned on the degraded input. Contrary to conditional denoising formulations, InDI directly proceeds by iteratively restoring the input low-quality image, producing high-quality results on a variety of image restoration tasks, including motion and out-of-focus deblurring, super-resolution, compression artifact removal, and denoising."
"Y. Ma, Huan Yang, Wenjing Wang, Jianlong Fu, Jiaying Liu",d4b0fa75565e873eea165e7059435bb55ddeb9ef,Unified Multi-Modal Latent Diffusion for Joint Subject and Text Conditional Image Generation,ArXiv,2023,2,"Language-guided image generation has achieved great success nowadays by using diffusion models. However, texts can be less detailed to describe highly-specific subjects such as a particular dog or a certain car, which makes pure text-to-image generation not accurate enough to satisfy user requirements. In this work, we present a novel Unified Multi-Modal Latent Diffusion (UMM-Diffusion) which takes joint texts and images containing specified subjects as input sequences and generates customized images with the subjects. To be more specific, both input texts and images are encoded into one unified multi-modal latent space, in which the input images are learned to be projected to pseudo word embedding and can be further combined with text to guide image generation. Besides, to eliminate the irrelevant parts of the input images such as background or illumination, we propose a novel sampling technique of diffusion models used by the image generator which fuses the results guided by multi-modal input and pure text input. By leveraging the large-scale pre-trained text-to-image generator and the designed image encoder, our method is able to generate high-quality images with complex semantics from both aspects of input texts and images."
"Jiarui Xu, Sifei Liu, Arash Vahdat, Wonmin Byeon, Xiaolong Wang, Shalini De Mello",323400245885e08ad498cd108e30e18020662278,Open-Vocabulary Panoptic Segmentation with Text-to-Image Diffusion Models,ArXiv,2023,2,"We present ODISE: Open-vocabulary DIffusion-based panoptic SEgmentation, which unifies pre-trained text-image diffusion and discriminative models to perform open-vocabulary panoptic segmentation. Text-to-image diffusion models have the remarkable ability to generate high-quality images with diverse open-vocabulary language descriptions. This demonstrates that their internal representation space is highly correlated with open concepts in the real world. Text-image discriminative models like CLIP, on the other hand, are good at classifying images into open-vocabulary labels. We leverage the frozen internal representations of both these models to perform panoptic segmentation of any category in the wild. Our approach outperforms the previous state of the art by significant margins on both open-vocabulary panoptic and semantic segmentation tasks. In particular, with COCO training only, our method achieves 23.4 PQ and 30.0 mIoU on the ADE20K dataset, with 8.3 PQ and 7.9 mIoU absolute improvement over the previous state of the art. We open-source our code and models at https://github.com/NVlabs/ODISE ."
"Duygu Ceylan, C. Huang, N. Mitra",32a3c2fbd3e733bd0eea938517fec2ff8dc7c701,Pix2Video: Video Editing using Image Diffusion,,2023,1,"Image diffusion models, trained on massive image collections, have emerged as the most versatile image generator model in terms of quality and diversity. They support inverting real images and conditional (e.g., text) generation, making them attractive for high-quality image editing applications. We investigate how to use such pre-trained image models for text-guided video editing. The critical challenge is to achieve the target edits while still preserving the content of the source video. Our method works in two simple steps: first, we use a pre-trained structure-guided (e.g., depth) image diffusion model to perform text-guided edits on an anchor frame; then, in the key step, we progressively propagate the changes to the future frames via self-attention feature injection to adapt the core denoising step of the diffusion model. We then consolidate the changes by adjusting the latent code for the frame before continuing the process. Our approach is training-free and generalizes to a wide range of edits. We demonstrate the effectiveness of the approach by extensive experimentation and compare it against four different prior and parallel efforts (on ArXiv). We demonstrate that realistic text-guided video edits are possible, without any compute-intensive preprocessing or video-specific finetuning."
"Levon Khachatryan, A. Movsisyan, Vahram Tadevosyan, Roberto Henschel, Zhangyang Wang, Shant Navasardyan, Humphrey Shi",923a03032014a12c4e8b26511c0394e1b915fe74,Text2Video-Zero: Text-to-Image Diffusion Models are Zero-Shot Video Generators,,2023,1,"Recent text-to-video generation approaches rely on computationally heavy training and require large-scale video datasets. In this paper, we introduce a new task of zero-shot text-to-video generation and propose a low-cost approach (without any training or optimization) by leveraging the power of existing text-to-image synthesis methods (e.g., Stable Diffusion), making them suitable for the video domain. Our key modifications include (i) enriching the latent codes of the generated frames with motion dynamics to keep the global scene and the background time consistent; and (ii) reprogramming frame-level self-attention using a new cross-frame attention of each frame on the first frame, to preserve the context, appearance, and identity of the foreground object. Experiments show that this leads to low overhead, yet high-quality and remarkably consistent video generation. Moreover, our approach is not limited to text-to-video synthesis but is also applicable to other tasks such as conditional and content-specialized video generation, and Video Instruct-Pix2Pix, i.e., instruction-guided video editing. As experiments show, our method performs comparably or sometimes better than recent approaches, despite not being trained on additional video data. Our code will be open sourced at: https://github.com/Picsart-AI-Research/Text2Video-Zero ."
"Felix Friedrich, P. Schramowski, Manuel Brack, Lukas Struppek, Dominik Hintersdorf, Sasha Luccioni, K. Kersting",3ea713d77e7d6e579a060a3751669958a253e42d,Fair Diffusion: Instructing Text-to-Image Generation Models on Fairness,ArXiv,2023,1,"Generative AI models have recently achieved astonishing results in quality and are consequently employed in a fast-growing number of applications. However, since they are highly data-driven, relying on billion-sized datasets randomly scraped from the internet, they also suffer from degenerated and biased human behavior, as we demonstrate. In fact, they may even reinforce such biases. To not only uncover but also combat these undesired effects, we present a novel strategy, called Fair Diffusion, to attenuate biases after the deployment of generative text-to-image models. Specifically, we demonstrate shifting a bias, based on human instructions, in any direction yielding arbitrarily new proportions for, e.g., identity groups. As our empirical evaluation demonstrates, this introduced control enables instructing generative image models on fairness, with no data filtering and additional training required."
"Kevin Clark, Priyank Jaini",206fbce3adb594516eedecca83c6e70118829805,Text-to-Image Diffusion Models are Zero-Shot Classifiers,,2023,1,"The excellent generative capabilities of text-to-image diffusion models suggest they learn informative representations of image-text data. However, what knowledge their representations capture is not fully understood, and they have not been thoroughly explored on downstream tasks. We investigate diffusion models by proposing a method for evaluating them as zero-shot classifiers. The key idea is using a diffusion model's ability to denoise a noised image given a text description of a label as a proxy for that label's likelihood. We apply our method to Imagen, using it to probe fine-grained aspects of Imagen's knowledge and comparing it with CLIP's zero-shot abilities. Imagen performs competitively with CLIP on a wide range of zero-shot image classification datasets. Additionally, it achieves state-of-the-art results on shape/texture bias tests and can successfully perform attribute binding while CLIP cannot. Although generative pre-training is prevalent in NLP, visual foundation models often use other methods such as contrastive learning. Based on our findings, we argue that generative pre-training should be explored as a compelling alternative for vision and vision-language problems."
"Shanghua Gao, Pan Zhou, Mingg-Ming Cheng, Shuicheng Yan",ca21f28e2a0a8205038301d8385151ab7ca2a050,Masked Diffusion Transformer is a Strong Image Synthesizer,,2023,1,"Despite its success in image synthesis, we observe that diffusion probabilistic models (DPMs) often lack contextual reasoning ability to learn the relations among object parts in an image, leading to a slow learning process. To solve this issue, we propose a Masked Diffusion Transformer (MDT) that introduces a mask latent modeling scheme to explicitly enhance the DPMs' ability of contextual relation learning among object semantic parts in an image. During training, MDT operates on the latent space to mask certain tokens. Then, an asymmetric masking diffusion transformer is designed to predict masked tokens from unmasked ones while maintaining the diffusion generation process. Our MDT can reconstruct the full information of an image from its incomplete contextual input, thus enabling it to learn the associated relations among image tokens. Experimental results show that MDT achieves superior image synthesis performance, e.g. a new SoTA FID score on the ImageNet dataset, and has about 3x faster learning speed than the previous SoTA DiT. The source code is released at https://github.com/sail-sg/MDT."
"Binxu Wang, John J. Vastola",3392075cfa2ff1a73c0637b685f6270b1d219304,"Diffusion Models Generate Images Like Painters: an Analytical Theory of Outline First, Details Later",ArXiv,2023,1,"How do diffusion generative models convert pure noise into meaningful images? We argue that generation involves first committing to an outline, and then to finer and finer details. The corresponding reverse diffusion process can be modeled by dynamics on a (time-dependent) high-dimensional landscape full of Gaussian-like modes, which makes the following predictions: (i) individual trajectories tend to be very low-dimensional; (ii) scene elements that vary more within training data tend to emerge earlier; and (iii) early perturbations substantially change image content more often than late perturbations. We show that the behavior of a variety of trained unconditional and conditional diffusion models like Stable Diffusion is consistent with these predictions. Finally, we use our theory to search for the latent image manifold of diffusion models, and propose a new way to generate interpretable image variations. Our viewpoint suggests generation by GANs and diffusion models have unexpected similarities."
