authors,paperId,title,venue,year,no_citations,abstract
"Maoyuan Xu, Xiaoping Xie",a949070ef347653f9064f3fc89c4760e3fe16d21,An efficient feature-preserving PDE algorithm for image denoising based on a spatial-fractional anisotropic diffusion equation,ArXiv,2021,3,"How to effectively remove the noise while preserving the image structure features is a challenging issue in the field of image denoising. In recent years, fractional PDE based methods have attracted more and more research efforts due to the ability to balance the noise removal and the preservation of image edges and textures. Among the existing fractional PDE algorithms, there are only a few using spatial fractional order derivatives, and all the fractional derivatives involved are one-sided derivatives. In this paper, an efficient feature-preserving fractional PDE algorithm is proposed for image denoising based on a nonlinear spatial-fractional anisotropic diffusion equation. Two-sided Grümwald-Letnikov fractional derivatives were used in the PDE model which are suitable to depict the local self-similarity of images. The Short Memory Principle is employed to simplify the approximation scheme. Experimental results show that the proposed method is of a satisfactory performance, i.e. it keeps a remarkable balance between noise removal and feature preserving, and has an extremely high structural retention property."
"J. Gholam, F. Szczepankiewicz, C. Tax, Lars Mueller, E. Kopanoglu, M. Nilsson, S. Aja‐Fernández, Matt Griffin, Derek K. Jones, L. Beltrachini",195b1581533a34b4df066a8ceff9fa28a1427ac5,aDWI-BIDS: an extension to the brain imaging data structure for advanced diffusion weighted imaging,,2021,2,"1School of Physics and Astronomy, Cardiff University, Cardiff, United Kingdom 2Cardiff Univeristy Brain Research Imaging Centre (CUBRIC), Cardiff, United Kingdom 3Department of Diagnostic Radiology, Lund University, Lund, Sweden 4Image Sciences Institute, University Medical Center Utrecht, Utrecht, Netherlands 5School of Psychology, Cardiff University, Cardiff, United Kingdom 6Universidad de Valladolid, Valladolid, Spain"
"Y. Liang, Chuang Niu, Chen Wei, Shenghan Ren, W. Cong, Ge Wang",cfb1997aeb113235d6173b2321331a0d0f819d1e,Phase function estimation from a diffuse optical image via deep learning,Physics in Medicine and Biology,2021,1,"Objective. The phase function is a key element of a light propagation model for Monte Carlo (MC) simulation, which is usually fitted with an analytic function with associated parameters. In recent years, machine learning methods were reported to estimate the parameters of the phase function of a particular form such as the Henyey–Greenstein phase function but, to our knowledge, no studies have been performed to determine the form of the phase function. Approach. Here we design a convolutional neural network (CNN) to estimate the phase function from a diffuse optical image without any explicit assumption on the form of the phase function. Specifically, we use a Gaussian mixture model (GMM) as an example to represent the phase function generally and learn the model parameters accurately. The GMM is selected because it provides the analytic expression of phase function to facilitate deflection angle sampling in MC simulation, and does not significantly increase the number of free parameters. Main Results. Our proposed method is validated on MC-simulated reflectance images of typical biological tissues using the Henyey–Greenstein phase function with different anisotropy factors. The mean squared error of the phase function is 0.01 and the relative error of the anisotropy factor is 3.28%. Significance. We propose the first data-driven CNN-based inverse MC model to estimate the form of scattering phase function. The effects of field of view and spatial resolution are analyzed and the findings provide guidelines for optimizing the experimental protocol in practical applications."
"Numair Khan, Min H. Kim, J. Tompkin",df1a4b5cb1cec9a321f8c2accf72c4dd7ef866f9,Differentiable Diffusion for Dense Depth Estimation from Multi-view Images,Computer Vision and Pattern Recognition,2021,1,"We present a method to estimate dense depth by optimizing a sparse set of points such that their diffusion into a depth map minimizes a multi-view reprojection error from RGB supervision. We optimize point positions, depths, and weights with respect to the loss by differential splatting that models points as Gaussians with analytic transmittance. Further, we develop an efficient optimization routine that can simultaneously optimize the 50k+ points required for complex scene reconstruction. We validate our routine using ground truth data and show high reconstruction quality. Then, we apply this to light field and wider baseline images via self supervision, and show improvements in both average and outlier error for depth maps diffused from inaccurate sparse points. Finally, we compare qualitative and quantitative results to image processing and deep learning methods."
"J. Ding, Chi-Hsiang Chu, Mong-Na Lo Huang, Chien-Ching Hsu",3d6c4fb25b21fd8684c0298f0068779d4798757e,Dopamine Transporter SPECT Image Classification for Neurodegenerative Parkinsonism via Diffusion Maps and Machine Learning Classifiers,Annual Conference on Medical Image Understanding and Analysis,2021,1,
U. Nnolim,b325c6b26a2e65f2854d9d9828c5fcb725fdef38,Analysis of Multiscale Wavelet-based Fractional Gradient-Anisotropic Diffusion Fusion for single hazy and underwater image enhancement,ArXiv,2021,0,This report presents the results of a multi-scale wavelet based scheme for single image dehazing and underwater image enhancement. The scheme is fast and highly localized in addition to global enhancement of hazy images. A PDE-based formulation enables additional versatility as the iterative nature allows more flexibility for various types of images. Visual and objective results from experiments indicate that the proposed approach competes favourably or surpasses most of the state-of-the-art approaches.
"D. Ludwig, F. Laun, K. Klika, J. Rauch, M. Ladd, P. Bachert, T. Kuder",41d3dcb550b721d2b7e9e706339e9d3eb4a46819,Diffusion pore imaging in the presence of extraporal water.,"Journal of magnetic resonance (San Diego, Calif. 1997 : Print)",2021,0,
"Volker Grimm, Kevin J Liang",304fead298c2cd2a798003c22b173c157354ee7d,An extended Krylov subspace method for decoding edge-based compressed images by homogeneous diffusion,ArXiv,2021,0,The heat equation is often used in order to inpaint dropped data in inpainting-based lossy compression schemes. We propose an alternative way to numerically solve the heat equation by an extended Krylov subspace method. The method is very efficient with respect to the direct computation of the solution of the heat equation at large times. And this is exactly what is needed for decoding edge-compressed pictures by homogeneous diffusion.
"O. Ruesch, C. Woehler",4e13f78b2805170e9c2696640cef35a549a76de1,"The fillet of a rock on the Moon: Cohesion and size dependent abrasion rates from topographic diffusion, LRO/NAC and Apollo images",,2021,0,"The efficiency of regolith production is key in understanding the properties of airless surfaces. Debris aprons, of fillets, around rocks are an ubiquitous morphology on many surfaces without atmosphere, which origin and evolution are largely unknown. Here we show that fillet originates from the juxtaposed rock under abrasion and that rocks of different cohesion have fillets with distinct morphological evolution. Thus, a fillet around a rock allows to disentangle rock cohesion from its surface exposure age. By combing topographic diffusion modeling with images of blocks of known age on the Moon we find abrasion rates for cm-sized boulders similar to regional rates (0.2 mm/Myr), whereas for 10-m sized blocks the rate is two order of magnitude higher (20 mm/Myr). Rates for instances of rocks of higher strength are reduced by ~50%. Fillets around lunar rocks are consistent with abrasion by isotropic micrometeoroid bombardment."
"Benoit Anctil-Robitaille, Antoine Th'eberge, Pierre-Marc Jodoin, M. Descoteaux, Christian Desrosiers, H. Lombaert",f6309fb0b5739dfbd0e94949cbea951a102823e9,Manifold-aware synthesis of high-resolution diffusion from structural imaging,Frontiers in Neuroimaging,2021,0,"The physical and clinical constraints surrounding diffusion-weighted imaging (DWI) often limit the spatial resolution of the produced images to voxels up to eight times larger than those of T1w images. The detailed information contained in accessible high-resolution T1w images could help in the synthesis of diffusion images with a greater level of detail. However, the non-Euclidean nature of diffusion imaging hinders current deep generative models from synthesizing physically plausible images. In this work, we propose the first Riemannian network architecture for the direct generation of diffusion tensors (DT) and diffusion orientation distribution functions (dODFs) from high-resolution T1w images. Our integration of the log-Euclidean Metric into a learning objective guarantees, unlike standard Euclidean networks, the mathematically-valid synthesis of diffusion. Furthermore, our approach improves the fractional anisotropy mean squared error (FA MSE) between the synthesized diffusion and the ground-truth by more than 23% and the cosine similarity between principal directions by almost 5% when compared to our baselines. We validate our generated diffusion by comparing the resulting tractograms to our expected real data. We observe similar fiber bundles with streamlines having <3% difference in length, <1% difference in volume, and a visually close shape. While our method is able to generate diffusion images from structural inputs in a high-resolution space within 15 s, we acknowledge and discuss the limits of diffusion inference solely relying on T1w images. Our results nonetheless suggest a relationship between the high-level geometry of the brain and its overall white matter architecture that remains to be explored."
"S. O'Sullivan, Ruizhe Kang, Jules A. Gardener, A. Akey, C. Matt, J. Hoffman",18c0765fa0d7d341c92c32467dc20ddc1bfd2938,Imaging Se diffusion across the FeSe/SrTiO$_3$ interface,,2021,0,"Monolayer FeSe on SrTiO 3 superconducts with reported T c as high as 100 K, but the dramatic interfacial T c enhancement remains poorly understood. Oxygen vacancies in SrTiO 3 are known to enhance the interfacial electron doping, electron-phonon coupling, and superconducting gap, but the detailed mechanism is unclear. Here we apply scanning transmission electron microscopy (STEM) and electron energy loss spectroscopy (EELS) to FeSe/SrTiO 3 to image the diﬀusion of selenium into SrTiO 3 to an unexpected depth of several unit cells, consistent with the simultaneously observed depth proﬁle of oxygen vacancies. Our density functional theory (DFT) calculations support the crucial role of oxygen vacancies in facilitating the thermally driven Se diﬀusion. In contrast to excess Se in the FeSe monolayer or FeSe/SrTiO 3 interface that is typically removed during post-growth annealing, the diﬀused Se remains in the top few unit cells of the SrTiO 3 bulk after the extended post-growth annealing that is necessary to achieve superconductivity. Thus, the unexpected Se in SrTiO 3 may contribute to the interfacial electron doping and electron-phonon coupling that enhance T c , suggesting another important role for oxygen vacancies as facilitators of Se diﬀusion."
"Andrew C. Chiang, Po-Nan Li, S. Wakatsuki",5b3e90730f2ab435b7ca77b27b06685baf213bb5,An image-incorporated immersed boundary method for diffusion equations,ArXiv,2021,0,"A novel sharp interface ghost-cell based immersed boundary method has been proposed and its parameters have been optimized against an analytical model in diffusion applications. The proposed embedded constrained moving least-squares (ECMLS) algorithm minimizes the error of the interpolated concentration at the image point of the ghost point by applying a moving least-squares method on all internal nodes, near the ghost image point, and the associated mirrored image points of these internal nodes through the corresponding boundary conditions. Using an analytical model as a reference, the ECMLS algorithm is compared to the constrained moving least-squares (CMLS) algorithm and the staircase model using various grid sizes, interpolation basis functions, weight functions, and the penalty parameter of the constraint. It is found that using ECMLS algorithm in the investigated diffusion application, the incomplete quartic basis function yields the best performance while the quadratic, cubic, and bicubic basis functions also produce results better than the staircase model. It is also found that the linear and bilinear basis functions cannot produce results better than the staircase model in diffusion applications. It is shown that the optimal radius of the region of internal nodes used for interpolation scales with the logarithm of the boundary radius of curvature. It is shown that for the diffusion application, the proposed ECMLS algorithm produces lower errors at the boundary with better numerical stability over a wider range of basis functions, weight functions, boundary radius of curvature, and the penalty parameter than the CMLS algorithm."
Zhou Lan,0c4a7cf232a02db89fa12ffdf4b23a09d64417e0,Statistical Inference of Auto-correlated Eigenvalues with Applications to Diffusion Tensor Imaging,,2021,0,"Diffusion tensor imaging (DTI) is a prevalent neuroimaging tool in analyzing the anatomical structure. The distinguishing feature of DTI is that the voxel-wise variable is a 3× 3 positive definite matrix other than a scalar, describing the diffusion process at the voxel. Recently, several statistical methods have been proposed to analyze the DTI data. This paper focuses on the statistical inference of eigenvalues of DTI because it provides more transparent clinical interpretations. However, the statistical inference of eigenvalues is statistically challenging because few treat these responses as random eigenvalues. In our paper, we rely on the distribution of the Wishart matrix’s eigenvalues to model the random eigenvalues. A hierarchical model which captures the eigenvalues’ randomness and spatial auto-correlation is proposed to infer the local covariate effects. The Monte-Carlo Expectation-Maximization algorithm is implemented for parameter estimation. Both simulation studies and application to IXI data-set are used to demonstrate our proposal. The results show that our proposal is more proper in analyzing auto-correlated random eigenvalues compared to alternatives."
"W. Consagra, A. Venkataraman, Zhengwu Zhang",563a0350713914d4e7ee1d9a40244834b298763d,Optimized Diffusion Imaging for Brain Structural Connectome Analysis,IEEE Transactions on Medical Imaging,2021,0,"High angular resolution diffusion imaging (HARDI) is a type of diffusion magnetic resonance imaging (dMRI) that measures diffusion signals on a sphere in q-space. It has been widely used in data acquisition for human brain structural connectome analysis. To more accurately estimate the structural connectome, dense samples in q-space are often acquired, potentially resulting in long scanning times and logistical challenges. This paper proposes a statistical method to select q-space directions optimally and estimate the local diffusion function from sparse observations. The proposed approach leverages relevant historical dMRI data to calculate a prior distribution to characterize local diffusion variability in each voxel in a template space. For a new subject to be scanned, the priors are mapped into the subject-specific coordinate and used to help select the best q-space samples. Simulation studies demonstrate big advantages over the existing HARDI sampling and analysis framework. We also applied the proposed method to the Human Connectome Project data and a dataset of aging adults with mild cognitive impairment. The results indicate that with very few q-space samples (e.g., 15 or 20), we can recover structural brain networks comparable to the ones estimated from 60 or more diffusion directions with the existing methods."
"Ryutaro Tanno, Daniel E. Worrall, Enrico Kaden, D. Alexander",29f8bae5a9a68d8fdc885d2e026a8166bd1eed30,Uncertainty modelling in deep learning for safer neuroimage enhancement: Demonstration in diffusion MRI,NeuroImage,2020,44,
"S. Mohammadi, M. Callaghan",6e53ae16611e27ab6c5d8a93925483332c43bdb0,Towards in vivo g-ratio mapping using MRI: Unifying myelin and diffusion imaging,Journal of Neuroscience Methods,2020,32,
"R. Henriques, M. Palombo, S. Jespersen, N. Shemesh, H. Lundell, A. Ianuş",5cef5808f400db02e2e72fb5f3d8dc6799dab957,Double diffusion encoding and applications for biomedical imaging,Journal of Neuroscience Methods,2020,22,
"Bo Li, M. Groot, R. Steketee, R. Meijboom, M. Smits, M. Vernooij, M. Ikram, Jiren Liu, W. Niessen, E. Bron",f7d7f39ee26107caa001fb3048812f0657afbe8e,Neuro4Neuro: A neural network approach for neural tract segmentation using large-scale population-based diffusion imaging,NeuroImage,2020,21,
"M. Khalid Hossain, K. Hashizume, Y. Hatano",6f7fd690c07b39b0690e9b7a6739e1f48a03143d,Evaluation of the hydrogen solubility and diffusivity in proton-conducting oxides by converting the PSL values of a tritium imaging plate,Nuclear Materials and Energy,2020,18,
"Hongyu Li, Zifei Liang, C. Zhang, Ruiying Liu, Jing Li, Weihong Zhang, D. Liang, B. Shen, Xiaoliang Zhang, Y. Ge, Jiangyang Zhang, L. Ying",0c1293f451f3f2be18e0f8a5b3c1de020229e1c8,SuperDTI: Ultrafast DTI and fiber tractography with deep learning,Magnetic Resonance in Medicine,2020,17,To develop a deep learning–based reconstruction framework for ultrafast and robust diffusion tensor imaging and fiber tractography.
"M. Pizzolato, G. Gilbert, J. Thiran, M. Descoteaux, R. Deriche",b7ddf7fdf49b74558eda3ce337ef054df23e9e3c,Adaptive phase correction of diffusion-weighted images,NeuroImage,2020,14,
"Hong-Hsi Lee, E. Fieremans, D. Novikov",cf5ef055678af3c7e371b983a6fabd27b389e3cf,Realistic Microstructure Simulator (RMS): Monte Carlo simulations of diffusion in three-dimensional cell segmentations of microscopy images,Journal of Neuroscience Methods,2020,12,
"R. Ragusa, M. Spavone, E. Iodice, S. Brough, M. A. Raj, M. Paolillo, M. Cantiello, D. Forbes, A. Marca, G. D. Ago, R. Rampazzo, P. D. I. O. Capodimonte, U. Federico, School of Physics University of New South Wales, I. A. Observatory, Centre for Gravitational Astrophysics, S. U. O. Technology., I. D. A. -. P. U. C. Chile, I. Padova",d289bd1bcd73b165b1600293f80814a858b437f2,VEGAS: a VST Early-type GAlaxy Survey,Astronomy & Astrophysics,2020,12,"Context. This paper is based on the multi-band VST Early-type GAlaxy Survey (VEGAS) with the VLT Survey Telescope (VST). We present new deep photometry of the IC 1459 group in g and r band.
Aims. The main goal of this work is to investigate the photometric properties of the IC 1459 group, and to compare our results with those obtained for other galaxy groups studied in VEGAS, in order to provide an initial view of the variation of their properties as a function of the evolution of the system.
Methods. For all galaxies in the IC 1459 group, we fit isophotes and extract the azimuthally averaged surface-brightness profiles, the position angle, and ellipticity profiles as a function of the semi-major axis. We also extract the average colour profile. In each band, we estimate the total magnitude, effective radius, mean colour, and total stellar mass for each galaxy in the group. We then look at the structure of the brightest galaxies and the faint features in their outskirts, considering also the intragroup component.
Results. The wide field of view, long integration time, high angular resolution, and arcsec-level seeing of OmegaCAM at VST allow us to map the light distribution of IC 1459 down to a surface brightness level of 29.26 mag arcsec−2 in g band and 28.85 mag arcsec−2 in r band, and out to 7−10Re, and to detect the optical counterpart of HI gas around IC 1459. We also carry out an in-depth exploration of three low-density environments and provide information to understand how galaxy and group properties change with the group evolution stage.
Conclusions. Good agreement is found between our results and predictions of numerical simulations regarding the structural properties of the brightest galaxies of the groups. We suggest that the structure of the outer envelope of he brightest cluster galaxies (i.e. the signatures of past mergers and tidal interactions), the intra-group light, and the HI amount and distribution may be used as indicators of the evolutionary stage and mass assembly of galaxy groups."
"Jan Martin, Sebastian Endt, A. Wetscherek, T. Kuder, A. Doerfler, M. Uder, B. Hensel, F. Laun",a91ea111d24f07046d5caaee2b3bff8423edee31,Contrast-to-noise ratio analysis of microscopic diffusion anisotropy indices in q-space trajectory imaging.,Zeitschrift für Medizinische Physik,2020,9,
U. Nnolim,66ba10d26b594573546afa93437c60c7905cef12,Single Image De-Hazing via Multiscale Wavelet Decomposition and Estimation with Fractional Gradient-Anisotropic Diffusion Fusion,International Journal of Image and Graphics,2020,8,"This paper presents algorithms based on fractional multiscale gradient fusion and multilevel wavelet decomposition for underwater and hazy image enhancement. The algorithms utilize partial differential equation (PDE)-generated low- and high-frequency images fused via gradient domain and anisotropic diffusion. Furthermore, wavelet multi-level decomposition, estimation and adjustment of detail and approximation coefficients are employed in improving local and global enhancement. Solutions to halo effect are also developed using compressive bilateral filters or other nonlinear/nonlocal means filter. Ultimately, experimental comparisons indicate that the proposed methods surpass or are comparable to several algorithms from the literature."
"D. Forbes, J. Gannon, A. Romanowsky, A. Alabi, J. Brodie, W. Couch, A. Ferré-Mateu",03f675312b8902afe256cf01706cc88740b7b509,Stellar velocity dispersion and dynamical mass of the ultra diffuse galaxy NGC 5846_UDG1 from the keck cosmic web imager,,2020,8,"The ultra-diffuse galaxy in the NGC 5846 group (NGC 5846_UDG1) was shown to have a large number of globular cluster (GC) candidates from deep imaging as part of the VEGAS survey. Recently, Muller et al. published a velocity dispersion, based on a dozen of its GCs. Within their quoted uncertainties, the resulting dynamical mass allowed for either a dark matter free or a dark matter dominated galaxy. Here we present spectra from KCWI which reconfirms membership of the NGC 5846 group and reveals a stellar velocity dispersion for UDG1 of $\sigma_{GC}$ = 17 $\pm$ 2 km/s. Our dynamical mass, with a reduced uncertainty, indicates a very high contribution of dark matter within the effective radius. We also derive an enclosed mass from the locations and motions of the GCs using the Tracer Mass Estimator, finding a similar mass inferred from our stellar velocity dispersion. We find no evidence that the galaxy is rotating and is thus likely pressure-supported. The number of confirmed GCs, and the total number inferred for the system ($\sim$45), suggest a total halo mass of $\sim2 \times 10^{11}$ M$_{\odot}$. A cored mass profile is favoured when compared to our dynamical mass. Given its stellar mass of 1.1$\times$10$^{8}$ M$_{\odot}$, NGC 5846_UDG1 appears to be an ultra-diffuse galaxy with a dwarf-like stellar mass and an overly massive halo."
"Talon Chandler, H. Shroff, R. Oldenbourg, P. L. La Riviere",7b2f57473609d29f79622d6fe76b2581f2a60cda,"Spatio-angular fluorescence microscopy III. Constrained angular diffusion, polarized excitation, and high-NA imaging.",Journal of The Optical Society of America A-optics Image Science and Vision,2020,8,"We investigate rotational diffusion of fluorescent molecules in angular potential wells, the excitation and subsequent emissions from these diffusing molecules, and the imaging of these emissions with high-NA aplanatic optical microscopes. Although dipole emissions only transmit six low-frequency angular components, we show that angular structured illumination can alias higher-frequency angular components into the passband of the imaging system. We show that the number of measurable angular components is limited by the relationships between three time scales: the rotational diffusion time, the fluorescence decay time, and the acquisition time. We demonstrate our model by simulating a numerical phantom in the limits of fast angular diffusion, slow angular diffusion, and weak potentials."
"A. Reymbaut, A. Caron, G. Gilbert, F. Szczepankiewicz, M. Nilsson, S. Warfield, M. Descoteaux, B. Scherrer",5da77ca9883e72d2ab502e111b40e179fc149e1b,Magic DIAMOND: Multi-fascicle diffusion compartment imaging with tensor distribution modeling and tensor-valued diffusion encoding,Medical Image Anal.,2020,7,
