authors,paperId,title,venue,year,no_citations,abstract
"Yutong Xie, Quanzheng Li",469e9b5c3a9a978c27dd902e18a2dc1a6721a6a9,Measurement-conditioned Denoising Diffusion Probabilistic Model for Under-sampled Medical Image Reconstruction,International Conference on Medical Image Computing and Computer-Assisted Intervention,2022,13,"We propose a novel and unified method, measurement-conditioned denoising diffusion probabilistic model (MC-DDPM), for under-sampled medical image reconstruction based on DDPM. Different from previous works, MC-DDPM is defined in measurement domain (e.g. k-space in MRI reconstruction) and conditioned on under-sampling mask. We apply this method to accelerate MRI reconstruction and the experimental results show excellent performance, outperforming full supervision baseline and the state-of-the-art score-based reconstruction method. Due to its generative nature, MC-DDPM can also quantify the uncertainty of reconstruction. Our code is available on github."
"K. Sandstrom, E. Koch, A. Leroy, E. Rosolowsky, E. Emsellem, Rowan J. Smith, O. Egorov, T. Williams, K. Larson, Janice C. Lee, E. Schinnerer, D. Thilker, A. Barnes, F. Belfiore, F. Bigiel, G. Blanc, A. Bolatto, M. Boquien, Yixian Cao, J. Chastenet, M. Chevance, I. Chiang 江, D. Dale, C. Faesi, S. Glover, K. Grasha, B. Groves, Hamid Hassani, J. Henshaw, A. Hughes, Jaeyeon Kim, R. Klessen, K. Kreckel, J. Kruijssen, L. Lopez, Daizhong Liu, S. Meidt, E. Murphy, H. Pan, M. Querejeta, T. Saito, A. Sardone, M. Sormani, Jessica S. Sutter, A. Usero, E. Watkins",9655910d895681255e6a5bcdd9446c4473d04754,PHANGS–JWST First Results: Tracing the Diffuse Interstellar Medium with JWST Imaging of Polycyclic Aromatic Hydrocarbon Emission in Nearby Galaxies,Astrophysical Journal Letters,2022,13,"JWST observations of polycyclic aromatic hydrocarbon (PAH) emission provide some of the deepest and highest resolution views of the cold interstellar medium (ISM) in nearby galaxies. If PAHs are well mixed with the atomic and molecular gas and illuminated by the average diffuse interstellar radiation field, PAH emission may provide an approximately linear, high-resolution, high-sensitivity tracer of diffuse gas surface density. We present a pilot study that explores using PAH emission in this way based on Mid-Infrared Instrument observations of IC 5332, NGC 628, NGC 1365, and NGC 7496 from the Physics at High Angular resolution in Nearby GalaxieS-JWST Treasury. Using scaling relationships calibrated in Leroy et al., scaled F1130W provides 10–40 pc resolution and 3σ sensitivity of Σgas ∼ 2 M ⊙ pc−2. We characterize the surface densities of structures seen at <7 M ⊙ pc−2 in our targets, where we expect the gas to be H i-dominated. We highlight the existence of filaments, interarm emission, and holes in the diffuse ISM at these low surface densities. Below ∼10 M ⊙ pc−2 for NGC 628, NGC 1365, and NGC 7496 the gas distribution shows a “Swiss cheese”-like topology due to holes and bubbles pervading the relatively smooth distribution of the diffuse ISM. Comparing to recent galaxy simulations, we observe similar topology for the low-surface-density gas, though with notable variations between simulations with different setups and resolution. Such a comparison of high-resolution, low-surface-density gas with simulations is not possible with existing atomic and molecular gas maps, highlighting the unique power of JWST maps of PAH emission."
"Riccardo Corvi, Davide Cozzolino, Giada Zingarini, G. Poggi, Koki Nagano, L. Verdoliva",05ce31d0e48c3e700b4fd606dbba3433ea83ab2b,On the detection of synthetic images generated by diffusion models,ArXiv,2022,12,"Over the past decade, there has been tremendous progress in creating synthetic media, mainly thanks to the development of powerful methods based on generative adversarial networks (GAN). Very recently, methods based on diffusion models (DM) have been gaining the spotlight. In addition to providing an impressive level of photorealism, they enable the creation of text-based visual content, opening up new and exciting opportunities in many different application fields, from arts to video games. On the other hand, this property is an additional asset in the hands of malicious users, who can generate and distribute fake media perfectly adapted to their attacks, posing new challenges to the media forensic community. With this work, we seek to understand how difficult it is to distinguish synthetic images generated by diffusion models from pristine ones and whether current state-of-the-art detectors are suitable for the task. To this end, first we expose the forensics traces left by diffusion models, then study how current detectors, developed for GAN-generated images, perform on these new synthetic images, especially in challenging social-networks scenarios involving image compression and resizing. Datasets and code are available at github.com/grip-unina/DMimageDetection."
"Binxin Yang, Shuyang Gu, Bo Zhang, Ting Zhang, Xuejin Chen, Xiaoyan Sun, Dong Chen, Fang Wen",4f1502111d35aa6651dfaedfeb1184b3c3dd2fcb,Paint by Example: Exemplar-based Image Editing with Diffusion Models,ArXiv,2022,12,"Language-guided image editing has achieved great success recently. In this paper, for the first time, we investigate exemplar-guided image editing for more precise control. We achieve this goal by leveraging self-supervised training to disentangle and re-organize the source image and the exemplar. However, the naive approach will cause obvious fusing artifacts. We carefully analyze it and propose an information bottleneck and strong augmentations to avoid the trivial solution of directly copying and pasting the exemplar image. Meanwhile, to ensure the controllability of the editing process, we design an arbitrary shape mask for the exemplar image and leverage the classifier-free guidance to increase the similarity to the exemplar image. The whole framework involves a single forward of the diffusion model without any iterative optimization. We demonstrate that our method achieves an impressive performance and enables controllable editing on in-the-wild images with high fidelity."
"Junde Wu, Huihui Fang, Yu Zhang, Yehui Yang, Yanwu Xu",c266aedf9660a70d15d02f53242c6fcebe7b4b8c,MedSegDiff: Medical Image Segmentation with Diffusion Probabilistic Model,ArXiv,2022,12,"Diffusion probabilistic model (DPM) recently becomes one of the hottest topic in computer vision. Its image generation application such as Imagen, Latent Diffusion Models and Stable Diffusion have shown impressive generation capabilities, which aroused extensive discussion in the community. Many recent studies also found it is useful in many other vision tasks, like image deblurring, super-resolution and anomaly detection. Inspired by the success of DPM, we propose the first DPM based model toward general medical image segmentation tasks, which we named MedSegDiff. In order to enhance the step-wise regional attention in DPM for the medical image segmentation, we propose dynamic conditional encoding, which establishes the state-adaptive conditions for each sampling step. We further propose Feature Frequency Parser (FF-Parser), to eliminate the negative effect of high-frequency noise component in this process. We verify MedSegDiff on three medical segmentation tasks with different image modalities, which are optic cup segmentation over fundus images, brain tumor segmentation over MRI images and thyroid nodule segmentation over ultrasound images. The experimental results show that MedSegDiff outperforms state-of-the-art (SOTA) methods with considerable performance gap, indicating the generalization and effectiveness of the proposed model. Our code is released at https://github.com/WuJunde/MedSegDiff."
"Xingqian Xu, Zhangyang Wang, Eric Zhang, Kai Wang, Humphrey Shi",78550c60dcdcdd8ca30f5838bcdbace1e8c9ba15,"Versatile Diffusion: Text, Images and Variations All in One Diffusion Model",ArXiv,2022,11,"Recent advances in diffusion models have set an impressive milestone in many generation tasks, and trending works such as DALL-E2, Imagen, and Stable Diffusion have attracted great interest. Despite the rapid landscape changes, recent new approaches focus on extensions and performance rather than capacity, thus requiring separate models for separate tasks. In this work, we expand the existing single-flow diffusion pipeline into a multi-task multimodal network, dubbed Versatile Diffusion (VD), that handles multiple flows of text-to-image, image-to-text, and variations in one unified model. The pipeline design of VD instantiates a unified multi-flow diffusion framework, consisting of sharable and swappable layer modules that enable the crossmodal generality beyond images and text. Through extensive experiments, we demonstrate that VD successfully achieves the following: a) VD outperforms the baseline approaches and handles all its base tasks with competitive quality; b) VD enables novel extensions such as disentanglement of style and semantics, dual- and multi-context blending, etc.; c) The success of our multi-flow multimodal framework over images and text may inspire further diffusion-based universal AI research. Our code and models are open-sourced at https://github.com/SHI-Labs/Versatile-Diffusion."
"Zeyang Sha, Zheng Li, Ning Yu, Yang Zhang",cdd8f95bfd01496eb4ab81ad35afb3bd2000d762,DE-FAKE: Detection and Attribution of Fake Images Generated by Text-to-Image Diffusion Models,ArXiv,2022,11,"Diffusion models emerge to establish the new state of the art in the visual generation. In particular, text-to-image diffusion models that generate images based on caption descriptions have attracted increasing attention, impressed by their user controllability. Despite encouraging performance, they exaggerate concerns of fake image misuse and cast new pres-sures on fake image detection. In this work, we pioneer a systematic study of the authenticity of fake images generated by text-to-image diffusion models. In particular, we conduct comprehensive studies from two perspectives unique to the text-to-image model, namely, visual modality and linguistic modality. For visual modality, we propose universal detection that demonstrates fake images of these text-to-image diffusion models share common cues, which enable us to distinguish them apart from real images. We then propose source attribution that reveals the uniqueness of the ﬁngerprints held by each diffusion model, which can be used to attribute each fake image to its model source. A variety of ablation and analysis studies further interpret the improvements from each of our proposed methods. For linguistic modality, we delve deeper to comprehensively analyze the impacts of text captions (called prompt analysis ) on the image authenticity of text-to-image diffusion models, and reason the impacts to the detection and attribution performance of fake images. All ﬁndings contribute to the community’s insight into the natural properties of text-to-image diffusion models, and we appeal to our community’s consideration on the counterpart solutions, like ours, against the rapidly-evolving fake image generators."
"Jiale Xu, Xintao Wang, Weihao Cheng, Yan-Pei Cao, Ying Shan, Xiaohu Qie, Shenghua Gao",9432bd77fa374d794bf2c8703b0e0e460380771f,Dream3D: Zero-Shot Text-to-3D Synthesis Using 3D Shape Prior and Text-to-Image Diffusion Models,ArXiv,2022,11,"Recent CLIP-guided 3D optimization methods, such as DreamFields and PureCLIPNeRF, have achieved impressive results in zero-shot text-to-3D synthesis. However, due to scratch training and random initialization without prior knowledge, these methods often fail to generate accurate and faithful 3D structures that conform to the input text. In this paper, we make the first attempt to introduce explicit 3D shape priors into the CLIP-guided 3D optimization process. Specifically, we first generate a high-quality 3D shape from the input text in the text-to-shape stage as a 3D shape prior. We then use it as the initialization of a neural radiance field and optimize it with the full prompt. To address the challenging text-to-shape generation task, we present a simple yet effective approach that directly bridges the text and image modalities with a powerful text-to-image diffusion model. To narrow the style domain gap between the images synthesized by the text-to-image diffusion model and shape renderings used to train the image-to-shape generator, we further propose to jointly optimize a learnable text prompt and fine-tune the text-to-image diffusion model for rendering-style image generation. Our method, Dream3D, is capable of generating imaginative 3D content with superior visual quality and shape accuracy compared to state-of-the-art methods."
"Ozan Özdenizci, R. Legenstein",69beb616ffdc42afe86b7487c5db82b6d88638b8,Restoring Vision in Adverse Weather Conditions with Patch-Based Denoising Diffusion Models,IEEE Transactions on Pattern Analysis and Machine Intelligence,2022,9,"Image restoration under adverse weather conditions has been of significant interest for various computer vision applications. Recent successful methods rely on the current progress in deep neural network architectural designs (e.g., with vision transformers). Motivated by the recent progress achieved with state-of-the-art conditional generative models, we present a novel patch-based image restoration algorithm based on denoising diffusion probabilistic models. Our patch-based diffusion modeling approach enables size-agnostic image restoration by using a guided denoising process with smoothed noise estimates across overlapping patches during inference. We empirically evaluate our model on benchmark datasets for image desnowing, combined deraining and dehazing, and raindrop removal. We demonstrate our approach to achieve state-of-the-art performances on both weather-specific and multi-weather image restoration, and experimentally show strong generalization to real-world test images."
"Robin Rombach, A. Blattmann, B. Ommer",0270ec4bc946b59c5cf6204be2553682dee0346c,Text-Guided Synthesis of Artistic Images with Retrieval-Augmented Diffusion Models,ArXiv,2022,9,"Novel architectures have recently improved generative image synthesis leading to excellent visual quality in various tasks. Of particular note is the field of ``AI-Art'', which has seen unprecedented growth with the emergence of powerful multimodal models such as CLIP. By combining speech and image synthesis models, so-called ``prompt-engineering'' has become established, in which carefully selected and composed sentences are used to achieve a certain visual style in the synthesized image. In this note, we present an alternative approach based on retrieval-augmented diffusion models (RDMs). In RDMs, a set of nearest neighbors is retrieved from an external database during training for each training instance, and the diffusion model is conditioned on these informative samples. During inference (sampling), we replace the retrieval database with a more specialized database that contains, for example, only images of a particular visual style. This provides a novel way to prompt a general trained model after training and thereby specify a particular visual style. As shown by our experiments, this approach is superior to specifying the visual style within the text prompt. We open-source code and model weights at https://github.com/CompVis/latent-diffusion ."
"Zijie J. Wang, Evan Montoya, David Munechika, Haoyang Yang, Benjamin Hoover, Duen Horng Chau",eef10b19c7560a8dfe012c773ac29c5038c787fb,DiffusionDB: A Large-scale Prompt Gallery Dataset for Text-to-Image Generative Models,ArXiv,2022,9,"With recent advancements in diffusion models, users can generate high-quality images by writing text prompts in natural language. However, generating images with desired details requires proper prompts, and it is often unclear how a model reacts to different prompts and what the best prompts are. To help researchers tackle these critical challenges, we introduce DiffusionDB, the first large-scale text-to-image prompt dataset. DiffusionDB contains 14 million images generated by Stable Diffusion using prompts and hyperparameters specified by real users. We analyze prompts in the dataset and discuss key properties of these prompts. The unprecedented scale and diversity of this human-actuated dataset provide exciting research opportunities in understanding the interplay between prompts and generative models, detecting deepfakes, and designing human-AI interaction tools to help users more easily use these models. DiffusionDB is publicly available at: https://poloclub.github.io/diffusiondb."
"Bahjat Kawar, Roy Ganz, Michael Elad",fdcd785502144fdee49e4169212962cfd3de4818,Enhancing Diffusion-Based Image Synthesis with Robust Classifier Guidance,ArXiv,2022,9,"Denoising diffusion probabilistic models (DDPMs) are a recent family of generative models that achieve state-of-the-art results. In order to obtain class-conditional generation, it was suggested to guide the diffusion process by gradients from a time-dependent classifier. While the idea is theoretically sound, deep learning-based classifiers are infamously susceptible to gradient-based adversarial attacks. Therefore, while traditional classifiers may achieve good accuracy scores, their gradients are possibly unreliable and might hinder the improvement of the generation results. Recent work discovered that adversarially robust classifiers exhibit gradients that are aligned with human perception, and these could better guide a generative process towards semantically meaningful images. We utilize this observation by defining and training a time-dependent adversarially robust classifier and use it as guidance for a generative diffusion model. In experiments on the highly challenging and diverse ImageNet dataset, our scheme introduces significantly more intelligible intermediate gradients, better alignment with theoretical findings, as well as improved generation results under several evaluation metrics. Furthermore, we conduct an opinion survey whose findings indicate that human raters prefer our method's results."
"Shin-I Cheng, Yu-Jie Chen, Wei-Chen Chiu, Hsin-Ying Lee, Hung-Yu Tseng",166314254ab27888fb49399dcf17764feb347a66,Adaptively-Realistic Image Generation from Stroke and Sketch with Diffusion Model,IEEE Workshop/Winter Conference on Applications of Computer Vision,2022,8,"Generating images from hand-drawings is a crucial and fundamental task in content creation. The translation is difficult as there exist infinite possibilities and the different users usually expect different outcomes. Therefore, we propose a unified framework supporting a three-dimensional control over the image synthesis from sketches and strokes based on diffusion models. Users can not only decide the level of faithfulness to the input strokes and sketches, but also the degree of realism, as the user inputs are usually not consistent with the real images. Qualitative and quantitative experiments demonstrate that our framework achieves state-of-the-art performance while providing flexibility in generating customized images with control over shape, color, and realism. Moreover, our method unleashes applications such as editing on real images, generation with partial sketches and strokes, and multi-domain multi-modal synthesis."
"A. Ulhaq, Naveed Akhtar, Ganna Pogrebna",f170754f8ab3187514292c12b1cbb431c0a8a634,Efficient Diffusion Models for Vision: A Survey,ArXiv,2022,8,"Diffusion Models (DMs) have demonstrated state-of-the-art performance in content generation without requiring adversarial training. These models are trained using a two-step process. First, a forward - diffusion - process gradually adds noise to a datum (usually an image). Then, a backward - reverse diffusion - process gradually removes the noise to turn it into a sample of the target distribution being modelled. DMs are inspired by non-equilibrium thermodynamics and have inherent high computational complexity. Due to the frequent function evaluations and gradient calculations in high-dimensional spaces, these models incur considerable computational overhead during both training and inference stages. This can not only preclude the democratization of diffusion-based modelling, but also hinder the adaption of diffusion models in real-life applications. Not to mention, the efficiency of computational models is fast becoming a significant concern due to excessive energy consumption and environmental scares. These factors have led to multiple contributions in the literature that focus on devising computationally efficient DMs. In this review, we present the most recent advances in diffusion models for vision, specifically focusing on the important design aspects that affect the computational efficiency of DMs. In particular, we emphasize the recently proposed design choices that have led to more efficient DMs. Unlike the other recent reviews, which discuss diffusion models from a broad perspective, this survey is aimed at pushing this research direction forward by highlighting the design strategies in the literature that are resulting in practicable models for the broader research community. We also provide a future outlook of diffusion models in vision from their computational efficiency viewpoint."
"Julia Wolleb, Robin Sandkühler, Florentin Bieder, P. Cattin",b3fd1450250bd8fe209f59247de558b5c14d5785,The Swiss Army Knife for Image-to-Image Translation: Multi-Task Diffusion Models,ArXiv,2022,8,"Recently, diffusion models were applied to a wide range of image analysis tasks. We build on a method for image-to-image translation using denoising diffusion implicit models and include a regression problem and a segmentation problem for guiding the image generation to the desired output. The main advantage of our approach is that the guidance during the denoising process is done by an external gradient. Consequently, the diffusion model does not need to be retrained for the different tasks on the same dataset. We apply our method to simulate the aging process on facial photos using a regression task, as well as on a brain magnetic resonance (MR) imaging dataset for the simulation of brain tumor growth. Furthermore, we use a segmentation model to inpaint tumors at the desired location in healthy slices of brain MR images. We achieve convincing results for all problems."
"Zolnamar Dorjsembe, Furen Xiao",e793a1c2b98c655eb20a1fe253b5eb2971e48917,Three-Dimensional Medical Image Synthesis with Denoising Diffusion Probabilistic Models,,2022,8,"Denoising diffusion probabilistic models (DDPM) have recently shown superior performance in image synthesis and have been extensively studied in various image processing tasks. In this work, we propose a 3D-DDPM for generating three-dimensional (3D) medical images. Different from previous studies, to the best of our knowledge, this work presents the first attempt to investigate the DDPM to enable 3D medical image synthesis. Our study examined the generation of high-resolution magnetic resonance images (MRI) of brain tumors. The proposed method is evaluated through experiments on a semi-public dataset, with both quantitative and qualitative tests showing promising results. Our code will be publicly available at https://github.com/DL-Circle/3D-DDPM."
"Ruihan Yang, S. Mandt",d236674b30807d1cbd0c8c80dd823b1160528717,Lossy Image Compression with Conditional Diffusion Models,ArXiv,2022,8,"This paper outlines an end-to-end optimized lossy image compression framework using diffusion generative models. The approach relies on the transform coding paradigm, where an image is mapped into a latent space for entropy coding and, from there, mapped back to the data space for reconstruction. In contrast to VAE-based neural compression, where the (mean) decoder is a deterministic neural network, our decoder is a conditional diffusion model. Our approach thus introduces an additional ``content'' latent variable on which the reverse diffusion process is conditioned and uses this variable to store information about the image. The remaining ``texture'' latent variables characterizing the diffusion process are synthesized (stochastically or deterministically) at decoding time. We show that the model's performance can be tuned toward perceptual metrics of interest. Our extensive experiments involving five datasets and sixteen image quality assessment metrics show that our approach yields the strongest reported FID scores while also yielding competitive performance with state-of-the-art models in several SIM-based reference metrics."
"Dominik Jens Elias Waibel, Ernst Rooell, Bastian Alexander Rieck, R. Giryes, Carsten Marr",616c95094f582623ae31926e7f95484b7788df4c,A Diffusion Model Predicts 3D Shapes from 2D Microscopy Images,ArXiv,2022,7,"Diffusion models are a special type of generative model, capable of synthesising new data from a learnt distribution. We introduce DISPR, a diffusion-based model for solving the inverse problem of three-dimensional (3D) cell shape prediction from two-dimensional (2D) single cell microscopy images. Using the 2D microscopy image as a prior, DISPR is conditioned to predict realistic 3D shape reconstructions. To showcase the applicability of DISPR as a data augmentation tool in a feature-based single cell classification task, we extract morphological features from the red blood cells grouped into six highly imbalanced classes. Adding features from the DISPR predictions to the three minority classes improved the macro F1 score from $F1_\text{macro} = 55.2 \pm 4.6\%$ to $F1_\text{macro} = 72.2 \pm 4.9\%$. We thus demonstrate that diffusion models can be successfully applied to inverse biomedical problems, and that they learn to reconstruct 3D shapes with realistic morphological features from 2D microscopy images."
